<?xml version="1.0"?>
<?xml-stylesheet type="text/xsl" href="ProjectXSL.xsl"?>
<!-- <root:ProjectLifeCycleDocuments -->
<ProjectLifecycleDocuments projectName="Interactive Lifecycle Document Development with Requirements Tracking" xmlns:xsi="http://www.w3.org/2001/XMLSchema-instance" xmlns:xi="http://www.w3.org/2001/XInclude" xsi:noNamespaceSchemaLocation="NotionalSchema.xsd">
	<Team>
		<TeamMember isNewest="true">
			<Name isNewest="true">Jeremiah Butler</Name>
			<UIC isNewest="true">UMASSD-2</UIC>
			<Role isNewest="true">Team Lead</Role>
		</TeamMember>
		<TeamMember isNewest="true">
			<Name isNewest="true">Peter Magalhaes</Name>
			<UIC isNewest="true">UMASSD-9</UIC>
			<Role isNewest="true">Team Member</Role>
		</TeamMember>
		<TeamMember isNewest="true">
			<Name isNewest="true">Aria Ushani</Name>
			<Role isNewest="true">Team Member</Role>
		</TeamMember>
		<TeamMember isNewest="false">
			<Name isNewest="true">Palmer</Name>
			<Role isNewest="true">Team</Role>
		</TeamMember>
		<TeamMember isNewest="false">
			<Name isNewest="true">New</Name>
			<UIC isNewest="true"></UIC>
			<Role isNewest="true">New</Role>
		</TeamMember>
		<TeamMember isNewest="false">
			<Name isNewest="true">New </Name>
			<UIC isNewest="true"></UIC>
			<Role isNewest="true">Role</Role>
		</TeamMember>
		<TeamMember isNewest="false">
			<Name isNewest="true">new</Name>
			<UIC isNewest="true"></UIC>
			<Role isNewest="true">role</Role>
		</TeamMember>
		<TeamMember isNewest="false">
			<Name isNewest="true">person</Name>
			<UIC isNewest="true"></UIC>
			<Role isNewest="true">add</Role>
		</TeamMember>
		<TeamMember isNewest="false">
			<Name isNewest="true">r</Name>
			<UIC isNewest="true"></UIC>
			<Role isNewest="true">g</Role>
		</TeamMember>
		<TeamMember isNewest="false">
			<Name isNewest="true">j</Name>
			<UIC isNewest="true"></UIC>
			<Role isNewest="true">k</Role>
		</TeamMember>
	</Team>
	<file_location>
		<xi:include href="NotionalSRS.xml" parse="xml">
			<xi:fallback>
				<p>The included document was not found!</p>
			</xi:fallback>
		</xi:include>
	</file_location>
	<file_location>
		<xi:include href="NotionalTestCase.xml">
			<xi:fallback>
				<p>The included document was not found!</p>
			</xi:fallback>
		</xi:include>
	</file_location>
	<file_location>
		<xi:include href="NotionalUseCase.xml">
			<xi:fallback>
				<p>The included document was not found!</p>
			</xi:fallback>
		</xi:include>
	</file_location>
</ProjectLifecycleDocuments>
