<?xml version="1.0"?>
<?xml-stylesheet type="text/xsl" href="NotionalUseCaseXSL.xsl"?>
<UseCaseDocument xml:base="projectName.xml" projectName="Lifecycle Documents with Requirements Tracking" xmlns:xsi="http://www.w3.org/2001/XMLSchema-instance" xsi:noNamespaceSchemaLocation="NotionalSchema.xsd">
	<Section isNewest="true" name="Introduction" id="UC1.0">
		<Title isNewest="true">PROJECT TITLE</Title>
		<Para isNewest="true" index="0">INSERT PROJECT GOAL</Para>
	</Section>
	<Section isNewest="true" name="UseCase" id="UC1.1">
		<Title isNewest="true">USE CASES</Title>
		<Requirement isNewest="true" id="UC1.1.1">
			<Title isNewest="true">CREATE PROJECT</Title>
			<Requirement isNewest="true" id="UC1.1.1.1">
				<Title isNewest="true">INSERT DESCRIPTION</Title>
				<Para isNewest="true" index="0">INSERT PROJECT DESCRIPTION, PRE-POST CONDITIONS, ETC. </Para>
			</Requirement>
		</Requirement>
	</Section>
</UseCaseDocument>
